<?xml version="1.0" encoding="UTF-8"?>
<!DOCTYPE company SYSTEM "nhansu.dtd">
<company>
    <department name="Kế toán">
        <employee id="E001">
            <name>Nguyễn Văn A</name>
            <position>Kế toán trưởng</position>
        </employee>
        <employee id="E002">
            <name>Trần Thị B</name>
            <position>Nhân viên kế toán</position>
        </employee>
    </department>
    
    <department name="Công nghệ thông tin">
        <employee id="E003">
            <name>Lê Hoàng C</name>
            <position>Trưởng phòng IT</position>
        </employee>
        <employee id="E004">
            <name>Phạm Minh D</name>
            <position>Lập trình viên Senior</position>
        </employee>
        <employee id="E005">
            <name>Hoàng Thị E</name>
            <position>Lập trình viên Junior</position>
        </employee>
    </department>
    
    <department name="Marketing">
        <employee id="E006">
            <name>Võ Thành F</name>
            <position>Marketing Manager</position>
        </employee>
    </department>
</company>
